{
  "$schema": "https://json-schema.org/draft/2020-12/schema",
  "$id": "https://github.com/agentic-delivery-lab/agentic-delivery-distribution/blob/main/manifests/workflow-bundle.schema.json",
  "title": "Agentic Delivery workflow bundle v1",
  "type": "object",
  "additionalProperties": false,
  "required": ["schemaVersion", "bundleVersion", "status", "controlPlane", "workflowSource", "files"],
  "properties": {
    "schemaVersion": { "const": 1 },
    "bundleVersion": { "type": "string" },
    "status": { "enum": ["draft", "released", "withdrawn"] },
    "controlPlane": { "type": "object", "required": ["repository", "commit", "contracts"], "additionalProperties": false, "properties": { "repository": { "type": "string" }, "commit": { "type": "string", "pattern": "^[0-9a-f]{40}$" }, "contracts": { "type": "object" } } },
    "architecture": { "type": "object", "required": ["repository", "commit", "contentSha256", "affectedIdentifiers"], "additionalProperties": false, "properties": { "repository": { "type": "string" }, "commit": { "type": "string", "pattern": "^[0-9a-f]{40}$" }, "contentSha256": { "type": "string", "pattern": "^[0-9a-f]{64}$" }, "affectedIdentifiers": { "type": "array", "minItems": 1, "items": { "type": "string" } } } },
    "workflowSource": { "type": "object", "required": ["repository", "commit"], "additionalProperties": false, "properties": { "repository": { "type": "string" }, "commit": { "type": "string", "pattern": "^[0-9a-f]{40}$" } } },
    "files": { "type": "array", "items": { "type": "object", "required": ["source", "target", "mode"], "additionalProperties": false, "properties": { "source": { "type": "string" }, "target": { "type": "string" }, "mode": { "enum": ["managed", "generated"] } } } }
  }
}
