{
  "$schema": "./workflow-bundle.schema.json",
  "schemaVersion": 1,
  "bundleVersion": "0.1.0-draft.26",
  "status": "draft",
  "controlPlane": {
    "repository": "agentic-delivery-lab/agentic-delivery",
    "commit": "98495275481aff381180771da6eba9da95bc7816",
    "contracts": {
      "eventEnvelope": 1,
      "lifecycle": "1.0.0",
      "stateMachine": "1.0.0"
    }
  },
  "architecture": {
    "repository": "agentic-delivery-lab/agentic-delivery-architecture",
    "commit": "59df514a3a6dc8a75b79b3fc75fe61aae4e6fdf3",
    "contentSha256": "02f150dfd46b8c304f61196ff65d7f8a05adc0cc151402573b10803491ac4550",
    "affectedIdentifiers": [
      "urn:agentic-delivery:architecture:authority"
    ]
  },
  "workflowSource": {
    "repository": "agentic-delivery-lab/agentic-delivery",
    "commit": "4d7448c0d628bd591d16c57082204391f1faeffd"
  },
  "files": [
    {
      "source": "bootstrap/templates/consumer/AGENTS.md",
      "target": "AGENTS.md",
      "mode": "managed"
    },
    {
      "source": "bootstrap/templates/consumer/.github/workflows/agentic-delivery-quality.yml",
      "target": ".github/workflows/agentic-delivery-quality.yml",
      "mode": "managed"
    },
    {
      "source": "bootstrap/templates/consumer/.github/workflows/agentic-delivery-architecture-review.yml",
      "target": ".github/workflows/agentic-delivery-architecture-review.yml",
      "mode": "managed"
    }
  ]
}
